Abrangência,Ano de Referência,Categoria Macro,Tipo de Pet,Métrica Detalhada,Valor,Unidade,Fonte,Citação
"I. População, Crescimento e Vulnerabilidade",,,,,,,,
Brasil,Indefinido,População Pet (Estimativa Geral),Total,População total estimada (3ª maior do mundo),150 a 160 Milhões,de animais,Abinpet (via Senado Notícias),
Brasil,Indefinido,População em Lares,Total,Porcentagem de lares que têm animais de estimação,> 50,Porcentagem (%),IBGE (via Instituto Pet Brasil),
Brasil,2020,População Pet (Lares),Total,População total estimada de animais de companhia em 2020,84 Milhões,Animais,Comac/Radar Pet 2020,
Brasil,2020,População Pet (Lares),Cães,Quantidade em lares (Radar Pet 2020),54 Milhões,Cachorros,Radar Pet 2020,
Brasil,2020,População Pet (Lares),Gatos,Quantidade em lares (Radar Pet 2020),30 Milhões,Gatos,Radar Pet 2020,
Brasil,2020,População Pet (Domicílios),Cães ou Gatos,Porcentagem de domicílios brasileiros com cães ou gatos,Cerca de 53,Porcentagem (%),Radar Pet 2020,
Brasil,2023,População Pet Atual,Cães,Quantidade em lares,68 Milhões,de animais,Abinpet,
Brasil,2023,População Pet Atual,Gatos,Quantidade em lares,34 Milhões,de animais,Abinpet,
Brasil,2023,Crescimento Anual,Gatos,Taxa de crescimento anual (maior que a de cães),6,% ao ano,Abinpet,
Brasil,2023,Crescimento Anual,Cães,Taxa de crescimento anual,3.5,% ao ano,Abinpet,
Brasil,2030,Projeção Populacional,Total,Projeção total de animais de companhia,101 Milhões,Animais,Comac/Radar Pet 2020,
Brasil,2030,Projeção Populacional,Gatos,Projeção em lares (Estimativa),41.6 Milhões,de animais,FGV / Radar Pet 2020,
Brasil,2030,Projeção Populacional,Cães,Projeção em lares (Estimativa),70.9 Milhões,de animais,FGV / Radar Pet 2020,
Brasil,2024,Vulnerabilidade Pet,Cães e Gatos,Total de animais em condições de vulnerabilidade (Estimativa),4.8 Milhões,de animais,Instituto Pet Brasil (IPB),
Brasil,2020,Vulnerabilidade Pet,Total,Total de animais em condição de vulnerabilidade (Pico),8.8 Milhões,de animais,Instituto Pet Brasil (IPB),
Brasil,2021,Impacto Social,Total,Aumento de animais de estimação em lares durante isolamento social,30,Porcentagem (%),Radar Pet 2021,
II. Abandono e Tutela (Quantitativos e Perfis),,,,,,,,
Brasil,Indefinido,Abandono (País),Cães e Gatos,% de animais no Brasil em situação de abandono (total),Aprox. 25,Porcentagem (%),Mars Petcare (Índice),
Brasil,Indefinido,Abandono (Quantidade),Cães e Gatos,Total de animais abandonados (Mars Petcare),"30,2 Milhões",Cães e Gatos,Mars Petcare (Índice),
Brasil,Indefinido,Abandono (Ruas),Cães,Quantidade de cães nas ruas no Brasil,"20,2 Milhões",Indivíduos,Mars Petcare (Índice),
Brasil,Indefinido,Abandono (Ruas),Gatos,Quantidade de gatos nas ruas no Brasil,10 Milhões,Animais,Mars Petcare (Índice),
Brasil,2024,Tutela ONGs (Total),Total,Total sob tutela de ONGs/Protetores independentes,201.000,Animais,Instituto Pet Brasil (IPB),
Brasil,2022,Tutela ONGs (Total),Total,Total sob tutela de ONGs/Protetores independentes (Levantamento 2022),184.960,Animais,Instituto Pet Brasil (IPB),
Brasil,2024,Tutela ONGs (Distribuição),Gatos,Porcentagem sob tutela de ONGs/Protetores independentes,92,Porcentagem (%),Instituto Pet Brasil (IPB),
Brasil,2024,Tutela ONGs (Distribuição),Cães,Porcentagem sob tutela de ONGs/Protetores independentes,8,Porcentagem (%),Instituto Pet Brasil (IPB),
Brasil,2022,Tutela ONGs (Quantidade),Cães,Quantidade sob tutela de ONGs/Protetores (diferença metodológica em relação a 2024),177.562,Animais,Instituto Pet Brasil (IPB),
Brasil,2022,Tutela ONGs (Quantidade),Gatos,Quantidade sob tutela de ONGs/Protetores (Levantamento 2022),7.398,Gatos,Instituto Pet Brasil (IPB),
Brasil,2022,Origem do Resgate,Total,Resgatados de situações de maus-tratos (do total sob tutela de ONGs),Perto de 60,Porcentagem (%),Instituto Pet Brasil (IPB),
Brasil,2022,Origem do Resgate,Total,Resgatados de abandonos (do total sob tutela de ONGs),40,Porcentagem (%),Instituto Pet Brasil (IPB),
Brasil,Indefinido,Comportamento Tutores,Total,% de tutores que consideram pets como membros da família,61,Porcentagem (%),MMA/DPDA,
Brasil,Indefinido,Abandono,Total,Período de maior incidência de fugas/desamparo,Final do ano,N/A,Juliana Valverde (ONG),
Brasil,Indefinido,Tutela ONGs (Porte),ONGs,Porcentagem de ONGs localizadas no Sudeste,45,Porcentagem (%),IPB,
Brasil,Indefinido,Tutela ONGs (Porte),ONGs,Tipo de porte predominante (abrigando de 100 a 500 animais),Médio,Porte,IPB,
Brasil,Indefinido,Risco de Renúncia,Cães,% de tutores que consideram renunciar ao pet nos próximos 12 meses,11,Porcentagem (%),Mars Petcare (Índice),
Brasil,Indefinido,Risco de Renúncia,Gatos,% de tutores que consideram renunciar ao pet nos próximos 12 meses,13,Porcentagem (%),Mars Petcare (Índice),
Brasil,Indefinido,Motivo Renúncia,Cães e Gatos,Não estar mais apto fisicamente (Principal motivo),28,Porcentagem (%),Mars Petcare (Índice),
Brasil,Indefinido,Motivo Renúncia,Cães e Gatos,Mudança de residência (Segundo motivo),24,Porcentagem (%),Mars Petcare (Índice),
III. Adoção e Guarda Responsável,,,,,,,,
Brasil,Indefinido,Adoção (Total),Total,Porcentagem total de pets (cães e gatos) adotados nos lares,80,Porcentagem (%),GoldeN/Opinion Box (2025),
Brasil,Indefinido,Adoção/Origem,Cães e Gatos,Origem do pet: Doações de pessoas próximas,37,Porcentagem (%),GoldeN/Opinion Box,
Brasil,Indefinido,Adoção/Origem,Cães e Gatos,Origem do pet: Resgate direto da rua,29,Porcentagem (%),GoldeN/Opinion Box,
Brasil,Indefinido,Adoção/Origem,Cães e Gatos,Origem do pet: Adoção via ONGs e abrigos,21,Porcentagem (%),GoldeN/Opinion Box,
Brasil,Indefinido,Adoção (Motivação),Total,Motivados a adotar por ajudar animal abandonado,50,Porcentagem (%),GoldeN/Opinion Box,
Brasil,Indefinido,Adoção (Dificuldade),Total,Principal desafio após adoção: Adaptação ao novo lar,26,Porcentagem (%),GoldeN/Opinion Box,
Brasil,Indefinido,Adoção (Dificuldade),Total,Desafio após adoção: Gastos inesperados,22,Porcentagem (%),GoldeN/Opinion Box,
Brasil,Indefinido,Microchipagem (Taxa),Cães,Porcentagem de cães microchipados,8,Porcentagem (%),Mars Petcare (Índice),
Brasil,Indefinido,Microchipagem (Taxa),Gatos,Porcentagem de gatos microchipados,10,Porcentagem (%),Mars Petcare (Índice),
Brasil,Indefinido,Castração (Taxa),Cães,Porcentagem de cães castrados,28,Porcentagem (%),Mars Petcare (Índice),
Brasil,Indefinido,Castração (Taxa),Gatos,Porcentagem de gatos castrados,53,Porcentagem (%),Mars Petcare (Índice),
Brasil,Indefinido,Perda/Recuperação,Cães,Porcentagem de cães já perdidos,39,Porcentagem (%),Mars Petcare (Índice),
Brasil,Indefinido,Perda/Recuperação,Gatos,Porcentagem de gatos já perdidos,31,Porcentagem (%),Mars Petcare (Índice),
Brasil,Indefinido,Perda/Recuperação,Cães,Taxa de recuperação de cães perdidos,35,Porcentagem (%),Mars Petcare (Índice),
Brasil,Indefinido,Perda/Recuperação,Gatos,Taxa de recuperação de gatos perdidos,33,Porcentagem (%),Mars Petcare (Índice),
IV. Carências Estruturais e Políticas Públicas (Municipal),,,,,,,,
Municípios Brasileiros (DPDA),2023,Carência Estrutural,Total,% de municípios sem órgão específico para combate a maus-tratos,45,Porcentagem de municípios (%),Pesquisa DPDA/MMA 2023,
Municípios Brasileiros (DPDA),2023,Carência Estrutural,Total,% de municípios sem estrutura para acolhimento (canil/gatil),76,Porcentagem de municípios (%),Pesquisa DPDA/MMA 2023,
Municípios Brasileiros (DPDA),2023,Carência Legislativa,Total,% de municípios sem legislação específica (bem-estar/controle populacional),62,Porcentagem de municípios (%),Pesquisa DPDA/MMA 2023,
Municípios Brasileiros (DPDA),2023,Carência Orçamentária,Total,% de municípios sem dotação orçamentária específica para bem-estar/controle populacional,60,Porcentagem de municípios (%),Pesquisa DPDA/MMA 2023,
Municípios Brasileiros (DPDA),2023,Gestão de Bem-Estar,Total,Controle populacional sob responsabilidade da Sec. Mun. Meio Ambiente,40,Porcentagem de municípios (%),Pesquisa DPDA/MMA 2023,
Municípios Brasileiros (DPDA),2023,Gestão de Bem-Estar,Total,Controle populacional sob responsabilidade da Sec. Mun. Saúde,37,Porcentagem de municípios (%),Pesquisa DPDA/MMA 2023,
Municípios Brasileiros (DPDA),2023,Gestão de Dados,Total,% de municípios que não possuem qualquer iniciativa de censo animal,67,Porcentagem de municípios (%),Pesquisa DPDA/MMA 2023,
Municípios Brasileiros (DPDA),2023,Urgência de Política,Total,% de municípios que consideram urgente implementar políticas contra abandono/maus-tratos,Mais de 55,Porcentagem de municípios (%),Pesquisa DPDA/MMA 2023,
V. Zoonoses e Estrutura de Saúde,,,,,,,,
Municípios Brasileiros (DPDA),2023,Zoonose Mais Preocupante,Leishmaniose,% de municípios com maior incidência,35,Porcentagem (%),Pesquisa DPDA/MMA 2023,
Municípios Brasileiros (DPDA),2023,Zoonose Preocupante,Esporotricose,% de municípios com maior incidência,15,Porcentagem (%),Pesquisa DPDA/MMA 2023,
Municípios Brasileiros (DPDA),2023,Zoonose Preocupante,Raiva,% de municípios com maior incidência,11,Porcentagem (%),Pesquisa DPDA/MMA 2023,
Municípios Brasileiros (DPDA),2023,Carência Estrutural Saúde,Total,% de municípios que não possuem Centro de Controle de Zoonose (CCZ),Mais de 67,Porcentagem de municípios (%),Pesquisa DPDA/MMA 2023,
Municípios Brasileiros (DPDA),2023,Carência Saúde Pública,Total,% de municípios que não realizam campanhas periódicas de combate a zoonoses,45,Porcentagem de municípios (%),Pesquisa DPDA/MMA 2023,
VI. Marco Legal e Punição,,,,,,,,
Brasil,Indefinido,Proteção Constitucional,Total,Proibição de práticas que sujeitem animais à crueldade,Art. 225(1)(VII),Constituição Federal,Constituição Federal (1988),
Brasil,Indefinido,Punição (Crimes Ambientais),Total,Pena para abuso ou maus-tratos,Detenção de 3 meses a 1 ano e multa,Lei 9.605/98,Lei 9.605/98,
Brasil,2020,Punição (Lei 14.064/20),Cães ou Gatos,"Pena aumentada para maus-tratos (reclusão, multa e proibição da guarda)",2 a 5 anos,Reclusão,Lei Federal 14.064/20,
Brasil,Indefinido,Punição (Código Penal),Total,Pena aumentada para maus-tratos,1 a 4 anos (e até 6 anos em caso de morte),Código Penal,Código Penal (2012),
Brasil,Indefinido,Legislação (Controle Pop.),Cães e Gatos,Regula o controle populacional por castração e posse responsável,Lei Federal 13.426/17,Lei Federal,,
São Paulo,Indefinido,Legislação (Controle Pop.),Cães e Gatos,Primeiro estado a banir eutanásia de cães e gatos sadios para controle populacional,Lei Estadual 12.916,Lei Estadual,,
VII. Legislação Pendente e Iniciativas Governamentais,,,,,,,,
Brasil,2024,Cadastro Nacional,Total,Criação do Cadastro Nacional de Animais Domésticos (SinPatinhas),Lei 15.046/2024,Lei Federal,Senado Federal,
Brasil,2025,Cadastro Nacional (Implantação),Cães e Gatos,Número de animais registrados no SinPatinhas (em Maio/2025),Mais de 620 Mil,Cães e Gatos,MMA/rádio gov,
Brasil,Pendente,Status Legal,Total,"Projeto que busca que animais não sejam considerados ""coisas"" no Código Civil",PL 351/2015,Senado Federal,,
Brasil,Pendente,Transporte Aéreo (Caixa),Total,Projeto que exige caixa de transporte 50% maior que o animal,PL 1.474/2024,Senado Federal,,
Brasil,Pendente,Transporte Aéreo (Cabine),Total,Projeto que permite transporte na cabine para pets de até 50kg,PL 1.510/2024,Senado Federal,,
Brasil,Pendente,Teste de Cosméticos,Total,Projeto que visa banir testes de cosméticos em animais no país,PL 70/2014,Câmara/Senado,,
Brasil,Pendente,Dezembro Verde,Total,"PL que institui o ""Dezembro Verde"" para combate ao abandono",PL 6.404/2019,Senado Federal,,
Brasil,Pendente,Regulamentação,Total,Projeto que cria diretrizes específicas de transporte aéreo em colaboração com órgãos reguladores,PL 1.903/2024,Senado Federal,,
Brasil,Pendente,Convivência em Condomínios,Total,Projeto que disciplina a guarda de animais de estimação em condomínios,PL 1.136/2022,Senado Federal,,
Brasil,2017,Exceção Legal,Total,"Emenda que permite esportes com animais (rodeios, vaquejadas) se forem ""manifestações culturais""",Emenda Constitucional,Constituição Federal,,
Brasil,2008,Uso Científico,Total,"Implementa os 3 Rs (Substituição, Redução, Refinamento) no uso de animais em pesquisa",Lei 11.794/08,CONCEA,,
Brasil,2014,Teste Cosméticos (Estadual),Total,Banimento de testes de cosméticos em animais no estado,Lei Estadual,São Paulo/Mato Grosso,,
Brasil,Indefinido,Progra. Governamental,Cães e Gatos,Institui o Programa Nacional de Proteção e Manejo Populacional Ético de Cães e Gatos,ProPatinhas,Decreto Federal,,
VIII. Iniciativas Estaduais e Programas (SP),,,,,,,,
São Paulo (SEMIL),2024,Castração (Serviços),Cães e Gatos,% de municípios que oferecem serviços permanentes de castração (em 151 cidades),62.3,Porcentagem de municípios (%),Pesquisa SEMIL 2024,
São Paulo (SEMIL),2024,Recursos Humanos,Cães e Gatos,% de prefeituras com médicos veterinários atuando no atendimento,Cerca de 75,Porcentagem de prefeituras (%),Pesquisa SEMIL 2024,
São Paulo (SEMIL),2024,Maus-Tratos (Acumulação),Total,% de municípios onde foi identificada acumulação de animais,45,Porcentagem de municípios (%),Pesquisa SEMIL 2024,
São Paulo (SEMIL),2026 (Projeção),Infraestrutura (Consultórios),Cães e Gatos,Previsão de consultórios Pet Contêiner a serem entregues,122,Unidades,Governo de SP (SEMIL),
